Comments,Comment_Id,Comment_ParentId,Timestamp
">Of course, as this is a virus, we have every reason to  >  >expect  >  >that a recovered person has immunity for a substantial period- there is currently no evidence against that, but as this is a novel virus, we can’t say for certain without evidence explicitly confirming that.You should read about the immunity research from SARS and MERS (other coronavirus infections recently).  The studies vary.  In MERS there were people that had absolutely no immunity, others averaged 3 years.  In SARS some have it still, others were as short as 3-6 months.Basically it's not a safe assumption that we'll acquire immunity and it will last a super long time.  I'm not sure why people think that is how viruses work. In fact some viruses make the second infection worse (due to amplifying the immune response) and others make subsequent infections with different viruses extremely severe, such as dengue.",fowvval,fovtkd4,2020-04-28 22:44:25
"The problem with antibodies is they only protect against ONE strain of virus, and there are at least 8 strains of Covid-19 floating around the world. Immunity from one strain doesn't mean immunity from other strains. This is why it's better to be safe until more is known.Since Covid-19 is a flu-type virus, it can and will mutate. That's why there is no vaccine for the common flu, there's thousands of strains and getting a flu shot will only immunize you for the more common strains so you can still catch the others. Scientists have said the mutation of Covid-19 is rather slow compared other flu viruses so that's good news. The bad news is we've never successfully developed a cure or vaccine for all previous Coronaviruses. And yes, we will not know any long term impacts until more time has passed. This is why I advocate the safe than sorry ... because once a person has caught it and has an unexpectedly bad outcome there's no going back to fix it.",fow5vvr,fovtkd4,2020-04-28 18:39:48
[removed],fow4vi5,fow4dbl,2020-04-28 18:30:52
"I make the following two guarantees to you:1. This will not happen.2. Once it doesn't happen, you will forget this paranoid prediction and immediately move onto believing another paranoid prediction.",foxbgjb,fowisi0,2020-04-29 01:44:11
"Headline from The Hill just 2 hours ago: ""Trump suggests coronavirus funding for states could be tied to sanctuary city policies"". Trump: ""But we'd want certain things also, including sanctuary city adjustments"". I had just read that article and then saw your reply. I do not believe that my concerns are unfounded, or unreasoned.",fowum5h,fowisi0,2020-04-28 22:31:35
No its not lmao get a grip,fowrseh,fowisi0,2020-04-28 22:02:50
The common cold is a rhinovirus though?,fovxysi,fovtf45,2020-04-28 17:31:29
"I just responded to a user who is. They just posted this:>I am hoping that by June, the places that ""re-opened"" early, will be seeing a spike in cases so bad that it can't be covered up or lied about, and saner heads will prevail.",fox9422,fovz7z4,2020-04-29 01:13:32
I think that Fauci and other doctors/nurses are getting REALLY big heads lately.,fow41q8,fovz7z4,2020-04-28 18:23:39
i know plan i did write “seems” did I not?,foy58nl,fox8juj,2020-04-29 09:06:49
"i dont expect to live....im buying myself time through this mitigation. When i get it, unless some therapeutics come through to help, I know what it is.",fowntmf,fowc0m6,2020-04-28 21:24:44
"Your comment has been removed because* **Incivility isn’t allowed on this sub.** We want to encourage a respectful discussion. ([More Information](https://www.reddit.com/r/Coronavirus/wiki/rules#wiki_rule_1.3A_be_civil))*I am a bot, and this action was performed automatically. Please [contact the moderators of this subreddit](/message/compose/?to=/r/Coronavirus) if you have any questions or concerns.*",foxxy9c,foxxy7r,2020-04-29 07:33:15
It’s exactly what you asked lol,foxvbbn,foxu9u1,2020-04-29 06:51:54
"I’m not trying to be alarmist. It’s a virus. It’s going to circulate until there’s a vaccine. It’s not nearly as deadly, but it’s tracking similar to the Spanish Flu. That lasted from January 1918 to December 1920. Science has advanced leaps and bounds since then, obviously, but we’re still dealing with a lot of unknowns. Would I like it to end before then? Yes, absolutely. Who wouldn’t? But vaccines take time, and we’ll be very lucky if they get it right the first time.We live in a new world now. Temporarily, anyway. Things will suck for a while. The best thing we can do now is continue to stay at home as much as humanly possible. A virus with nowhere to go will die. Unfortunately, there’s a lot of people that believe, for some reason, that asking them to stay home to prevent transmission of the virus is an infringement on their civil liberties or whatever, and that only extends the life of the virus.If we had a magic wand that could make everyone freeze in place for a month, we’d stomp this virus out. But we don’t, that’s impossible. So we have to make adjustments.And you can curse at me if it makes you feel better. Curse at the sky. Curse at whatever you feel like. But the unique thing about this is we’re all in this together. Everyone. Globally. I’m feeling the stress and frustration too. But humans have been through worse with less and survived, and we’ll survive this too.",fowj9n9,fowbwak,2020-04-28 20:41:06
Is that from a lack of oxygen?,fox44t0,fowvodx,2020-04-29 00:13:43
Thanks!!,foww9ua,foww8cd,2020-04-28 22:48:35
Well this is also with everyone trying to reopen and imagine if they send kids back to school...,fox8k4a,fox6t3h,2020-04-29 01:06:27
and what get the 5G directly injected?! No thank you. my phone is fast enough as is!,fox2eoe,fowc0sg,2020-04-28 23:54:19
"I can only predict with confidence that I’ll be stuck in my house with my kids for most of those 4 months, and that it’ll feel like 12.",foxzrhr,foxz4zp,2020-04-29 07:58:59
Warnings from experts aren't useless news.,fow5lkw,fow13m1,2020-04-28 18:37:17
"That it happens?  There is sufficient evidence.  That it’s common?  True, there is not sufficient evidence to say it would be common.",fowfno8,fowd48b,2020-04-28 20:07:30
"Yeah, this virus seems like pretty bad news.",fow78be,fow6q2i,2020-04-28 18:51:42
"NZ is locked down, and is largely cleared of ongoing infections, so they could keep their momentum from causing any resurgence. But it’s true that flu season is wherever it’s becoming cold, so it’s possible. The US’s fall will most likely follow months of increased travel, unlike NZ.",fowclg4,fow5shq,2020-04-28 19:39:38
"He said nothing definitive, no that there was no research",foy8ag8,foxozpt,2020-04-29 09:39:05
"Wow,  guess I hit a nerve lol",fovyvl9,fovyc7z,2020-04-28 17:39:11
Reddit thinks using that phrase makes them undisputed.,foy60af,fox86tf,2020-04-29 09:15:07
"It would take more like 70-75% to get full herd immunity... Assuming a person mingled with a wide variety of people which is not the case now.Plus it’s not all or nothing, the more people are immune the less people get it and spread it, so the infection rate will slow naturally to allow more time for therapeutics.But if 90% at an IFR of 0.5% you would have 1.575 million deaths.At 0.2% IFR you would have 630,000 deaths80% at IFR of 0.5% you would have 1.4 million deathsAt 0.2% IFR you would have 560,000 deaths70% at IFR of 0.5% you would have 1.2 million deaths.At 0.2% IFR you would have 490,000 deaths.Not a small number but spread out of a couple years, it’s not terribly high either.",fowenvs,fowdeb7,2020-04-28 19:58:20
It sucks absolute ass living alone right now. Struggling.,fowlx6i,fovz7ua,2020-04-28 21:06:14
Very true. Can't image how hard it is on those folks that are all alone :(,fovzt6o,fovz7ua,2020-04-28 17:47:04
I hear ya. I went from working out every single day to eating pasta and baking pastries every day. It's a rough time.,fovzrhd,fovynte,2020-04-28 17:46:40
"Lol that shit crazy man. I hope this dumb ho that stole my ps4 wasn’t working enough to get unemployment, haha loser! What’s that PS4 worth to you now!!! Stanke ass ho she was.",fowmm6k,fow5d82,2020-04-28 21:12:58
The drugs are kicking in bro!!!,fowmnbk,fow1b8x,2020-04-28 21:13:17
Yeah I end up just smokin dabs all day and not doing shit. I need to be “AT” work physically.,fowmpl1,fow1b54,2020-04-28 21:13:52
"Not going to lie, I've been doing super well during the lockdown. I got a job at a grocery store part time which keeps my sanity, and otherwise I'm working on my art (my ideal career) and doing a lot of planning in my life. Usually every time I try to get these done I get so many distractions that I get nowhere and get so frustrated. Now I'm incredibly productive. And I'm pretty introverted anyways so I'm a bit bummed on not seeing people but overall am low key relieved that I don't have to make excuses to not see people lol and just work on my art all night.",foxoaxp,fovz2a8,2020-04-29 04:55:08
"Yeah same here.  I was so stressed out with a shitty job and a shitty boss, the virus was getting to me.  Ended up quitting my job, found a new one I like.  I'm working 10 hours a day in the same time I was working 8 with a commute.  The best part for me is I'm working a lot because I enjoy what I'm doing. Sometimes being so stressed out can make you turn it around and appreciate what you have or what you should have.",foxhjgm,fovz2a8,2020-04-29 03:09:48
"On the flip side, about half the nights the last few weeks I've just laid in bed and though about hanging myself. Living by myself at home alone is not good for me.",fox4nxm,fovz2a8,2020-04-29 00:19:39
"Likewise. I was already working from home on  Mondays and Fridays  and the. Flew to my client up in the bay to work on site Tuesday - Thurs.  now it’s just all remote all the time.  I like not having to get up at 3:30 on Tues to make a 6 AM flight each week.  Also was having trouble seeing the point of my travel sometimes because when I would get to the site and half my clients were working from home anyhow to avoid traffic or were working from a different office a town over.  So nearly every meeting was at least half Skype attendees anyhow.  But I liked going up there so I don’t complain.  Fortunately, I can still work and everyone was already used to doing it remote at least part of the time anyhow.I can see though for people with families at home or ones that don’t have a dedicated office at home, how not being at the office can be harder.  But for me, it’s same old same old.",fowy6k3,fovz2a8,2020-04-28 23:08:30
I’ve tried working from home and I just do better working in the office. Work is different to me when I have a physical person standing in front of me rather than an email. Some text on a screen is a poor substitute for a live human face for me.,fowmuzk,fovz2a8,2020-04-28 21:15:20
"Also, nobody is calling and asking to hang out and making me feel bad for saying no. So that's a net positive...",fowlpsy,fovz2a8,2020-04-28 21:04:13
"I'm with you there. I have a husband that I love and pets that I love. It's been a bummer that I haven't felt comfortable visiting my parents. They are both in there mid-to-late 70's, and my father has other risk factors. I have visited them, but I wear a mask and stay 10 ft from them at all times. I just don't want to possibly drag anything in that infects them! it's certainly not the same comfy family dinners we've always enjoyed on a weekly basis, but we love one another and we understand why we are doing this. It is because of that love.Outside of that, I've worked from home pretty exclusively for the last decade. My routine is and has been set. I do a lot of video conferencing, and people have always remarked that my hair is done and my makeup is on. Well yes, that's been my routine for the last decade and I see no reason to alter it. It's a part of my preparation to face my work day and to be productive.But I have other coworkers on whom this is very hard. 1 30-something that works for me and his 30-something wife, while fortunate that they both maintain their employment to work from home, are having to do so with a two and a half year old and a seven month old. He commented to me that the reality is you can't be both 100% parent and 100% employee. Because I do not have children at home, I pick up his slack whenever possible. Another one of my co-workers is single, in his early 40s, and lives alone in downtown DC. prior to the pandemic, he had an active social life with friends and get togethers and game nights and wine tastings and happy hours, but he recognizes the threat and isn't doing any of that. I think being constantly alone is definitely getting to him.For all of you out there struggling with this, I feel you. Maybe not in my own personal self, but in what I observe with others who are close to me. Please know that this hardship and your sacrifice is recognized and valued. Those of us doing these things are doing it for others. Yes, we want to keep ourselves safe, but we're doing it for everyone else also. Never forget that.",fow6zp7,fovz2a8,2020-04-28 18:49:34
As someone who also has a 3-hour round trip commute the transition to telework the past 7 weeks has been a huge boon to my day-to-day happiness.,fow5yyd,fovz2a8,2020-04-28 18:40:35
I love staying in. But i cant see my girlfriend who lives far away. I am constantly worried about getting the virus. It sucks,fow5bc7,fovz2a8,2020-04-28 18:34:47
I'm an introvert but I hate using my home as my office since it's only 200sqft. The upside of this place is that it's a 10 min bike ride to the office. Sigh lol,fow30zj,fovz2a8,2020-04-28 18:14:38
"It's kind of scary how much I like this actually. I realized I am SUPER lazy if I don't have to do stuff. Like, if I didn't have to leave the house ever again, I think I'd be okay with that",fow2yc4,fovz2a8,2020-04-28 18:14:00
But when you own several businesses and have to worry about paying the rent on those buildings. And losing money each day from closure. It’s a different story than a commute. It sucks,fow2if6,fovz2a8,2020-04-28 18:10:12
Okay but that doesn't make the virus disappear either.,fowt54j,fowq7oh,2020-04-28 22:16:31
"It is a terrible side effect of the pandemic for sure. The economy will undoubtedly suffer, but the alternative is a whole lot of death. We should not be putting the economy over human life. I'm sure the politicians and big business owners will be able to come up with some ways to stimulate the economy after this is all over, but people really need to get the idea that everything can go back to normal put of their heads. Back to normal doesn't exist anymore, or at least won't for a very long time. My country's health services are putting measures in place to deal with this throughout 2021. At the very least it won't be over after summer.",foxpyy4,fovq9v7,2020-04-29 05:22:59
"Nurse here. You do recognize that without us, it would be MUCH worse, right? We’ve already had more people die from COVID in 4 months in the US than we’ve had die from flu ALL last year. And that was AFTER we shut down the whole planet. You’re angry with us? If it weren’t for your healthcare workers, ZERO states would be opening up again at all in 2020. Maybe be angry at those who say you only deserve a $1200 check one time? We get it. The economic situation f—ing SUCKS if you’re without work. But our job is to tell you “if we all don’t do _____, be warned, it’s gonna get much worse and we’ll have no choice but to close down again.” Be angry at those who are supposed to ensure the economic situation doesn’t destroy you...but thats not our job.",fows49k,fovq9v7,2020-04-28 22:06:07
"> I can see why people are quite upset with medical professionals in general. It’s really easy to support a lockdown that doesn’t crush your entire life when your place of work shuts downNo, they just have to watch people die of it.  Literally.",fovx2cz,fovq9v7,2020-04-28 17:23:51
"Hey man, that’s why people like doctors and lawyers and project engineers make the big bucks. We tell people the truth even if it hurts, up to you what’s done with that information. Public health officials aren’t too concerned with the political impact of a policy, it’s their job to simply propose the best solution to mitigate the effects of the epidemic. It’s up to our executive leadership to figure out the best political policies that can be feasibly implemented. Obviously public health officials would lock down the entire world for three months if they could and let the virus burn out, and politicians wouldn’t lock down the world for a minute if they could avoid negative economic impact. We all recognize what we all need is a compromise between these two positions.",fovtud7,fovq9v7,2020-04-28 16:57:00
"The economics of this pandemic will be horrific, no doubt about it. Especially in the USA. Wall street, big banks, big business of all types will be well protected while the rest of us will rot.It's our own fault too. The people in charge were put there by us. Most Americans never vote at all and it's  their fault more than others.",fovqz83,fovq9v7,2020-04-28 16:33:29
"SARS-CoV-2 is not an influenza type virus, rather a Coronavirus. It appears from early evidence that SARS-CoV-2 mutates at a rate similar to that of other Coronaviruses, which is substantially slower than that of influenza. 8 different strains doesn’t necessarily mean 8 different types of viruses to counter, in fact it seems like the antigens on each virus and antibodies needed to counter them are essentially similar enough that one vaccine should do the trick, at least as I write this. The 8 strains as it stands is mostly useful for measuring spread, and where it spread from. It’s true we haven’t really made vaccines for coronaviruses before, but keep in mind most coronaviruses in human transition prior to this outbreak caused the common cold, which is at most a minor inconvenience. SARS and MERS were certainly deadly, but they petered out before making a vaccine was profitable or useful. It’s not necessarily because of the difficulty.",fowjcnf,fow5vvr,2020-04-28 20:41:53
"I read that a big question about antibodies/immunity is that has not been determined what ""load"", or volume, of antibodies you need in order to be ""immune"". Like with the chicken pox virus; if you only had a very very mild case when you were 6, you could get the chicken pox again when you were 8. Does having a very mild, maybe asymptomatic case of COVID-19 in fact confer immunity? Is there a way to not just detect *any* antibody, but to determine how *many* antibodies you have? And how long does having antibodies protect you?",fowhp2d,fow5vvr,2020-04-28 20:26:31
"Now, someone correct me if I'm wrong.If I recall correctly, all the multiple covid-19 strains are similar enough that a vaccine or post infection immunity should work to defeat the other strains. Also, yes, it will mutate. But its slow enough that we should be able to stay ahead of it with a vaccine..",fow790s,fow5vvr,2020-04-28 18:51:53
"Your comment has been removed because* **Purely political posts and comments will be removed.** Political discussions can easily come to dominate online discussions. Therefore we remove political posts and comments and lock comments on borderline posts. ([More Information](https://www.reddit.com/r/Coronavirus/wiki/rules#wiki_rule_4.3A_avoid_politics))*I am a bot, and this action was performed automatically. Please [contact the moderators of this subreddit](/message/compose/?to=/r/Coronavirus) if you have any questions or concerns.*",fow4vjw,fow4vi5,2020-04-28 18:30:53
There are a lot of viruses that cause the “common cold”,fovyo81,fovxysi,2020-04-28 17:37:29
"The common cold is the name for the symptoms, it is caused by a variety of different viruses.~70% were caused by rhinovirus and ~20% were caused by coronavirus (not sars-cov2 but other types of coronavirus).",fovylcq,fovxysi,2020-04-28 17:36:48
"That’s so disheartening. While many people (myself included) are not expecting the places who re-opened too early to do well, you would think that they would wish for the best. I would love to be wrong about them opening too soon, because what would mean that the situation regarding the virus would be getting better, for everyone.",foxe9ty,fox9422,2020-04-29 02:22:40
Everyone in any kind of position of power is. While the rest of us suffer the collapsing economy and having our lives taken away from us,fowejng,fow41q8,2020-04-28 19:57:16
Are you serious with what you just wrote?Why in the hell do you believe you aren’t going to survive??,fownzi0,fowntmf,2020-04-28 21:26:18
You know vaccines aren’t 100% effective right,fowkc9h,fowj9n9,2020-04-28 20:51:10
"I’m pretty confident that this virus will be around for awhile too.  But I don’t think the government can hold or wants to hold stay at home quarantine orders beyond summer. The only way I see them able to do that is if they pass someBetter stimulus bill legislation, but the GOP is resisting that.",foy0687,foxzrhr,2020-04-29 08:04:40
"This isn’t a warning. It’s a speculation. A warning would be something like “stay at home. You going to crowded places makes the situation worse.”  A speculation is “if this treatment does not work, we’ll be screwed”.",fow6g5u,fow5lkw,2020-04-28 18:44:48
You didn’t.,fow3wxz,fovyvl9,2020-04-28 18:22:28
I live alone and am more on the introverted side. I’m pretty healthy mentally and six weeks of this is even wearing on me. I can only imagine what’s it’s doing to social people or those that may have mental illnesses. Feel really bad for them.,fow5t0x,fovzt6o,2020-04-28 18:39:07
"I live alone. It's not that bad, my PS4 is my best friend :). God of War is so fucking good. Got FF7 Remake and Persona 5 Royal in the backlog too, lets goooo",fow3flx,fovzt6o,2020-04-28 18:18:12
"I get to spend the quarantine with my wonderful wife. She works 8-4 in her home office and I’m laid off so I’m up all night. This gives me hours and hours of sweet sweet alone time. After finally getting my kids out of the house, I feel like I deserve this.",fow3don,fovzt6o,2020-04-28 18:17:44
My yoga mat is getting its worth a hundred times over these days. Doesn't replace the Y and my daily biking but it's something..,fow3oao,fovzrhd,2020-04-28 18:20:19
"Honestly, it’s an indescribable experience watching it while high.",fowrt3d,fowmnbk,2020-04-28 22:03:02
"OMG this,  it’s so nice not to have to come up with excuses for social obligations.  I’m more of a homebody.  Some of my friends aren’t and I get guilt tripped about not coming out sometimes when I’m just not interested,  I really hate crowds,",fowyixi,fowlpsy,2020-04-28 23:12:07
this really needs more upvotes. Thank you for supporting your employees!,fowwcdm,fow6zp7,2020-04-28 22:49:21
Right there with you.I wake up at 8:15 now right in time for my first meeting. I can go to bed after midnight. I’ve now been running and exercising every day.It’s been great for me.,fox40yg,fow5yyd,2020-04-29 00:12:29
"I'm sorry to hear that.  My gf and I live together and she works for a pharmacy.  We're 99.9% sure she had it considering the symptoms she had.  So I either somehow avoided it or was asymptomatic.  Either way I quarantined myself from everything.Not much of a consolation, but at least we live in an era that can utilize fairly clear live feeds to chat right?",fow6z0u,fow5bc7,2020-04-28 18:49:25
My exact situation.,fown3d6,fow30zj,2020-04-28 21:17:36
"This is a real problem for me and though I think I like it at the time (little to no stress and anxiety when spending time alone), later really regretting not doing more with my time. But more productive / forever etched in my memory things, not more wasting time at bars with people who aren't really friends just because. In those situations, I start thinking I'd rather be home.",foxeloz,fow2yc4,2020-04-29 02:27:20
That's more because people are terrible and society is rigged and shitty.If there were no people outside I'd love the outside.,fox9ej1,fow2yc4,2020-04-29 01:17:16
"Weirdly enough I feel more energized. I used to be tired all the time going to work but I wake up around 830 or 9am everyday and feel great. I am absolutely worried about the world and hoping for good news everyday but mentally, I feel like I'm doing really well.",fowzh35,fow2yc4,2020-04-28 23:22:01
"And that's OK.I ended up being a stay at home dog/cat dad. Not what I wanted but we moved for my wifes nursing position. There is no real work for me (IT).So I've been unemployed for almost 3 years.I take care of the house, laundry, meals etc.I FUCKING LOVE IT.FUCK A DAYJOB",fowylzb,fow2yc4,2020-04-28 23:12:58
"Same.I am a 25 year old, last semester senior in college.All of my classes are a breeze now, I don’t even really have finals. All exams and homework was reduced, my internship has slowed but I’m still getting paid.I literally sleep in until 11 4/7 days of the week simply because I have nothing to do that day.",fow6sfn,fow2yc4,2020-04-28 18:47:48
I feel the same way,fow5of7,fow2yc4,2020-04-28 18:38:00
Different scenario for everyone.  Luckily we have been able to work from home although I'm sensing furlough or layoffs coming soon.I wish the best to you and all of us.,fow3671,fow2if6,2020-04-28 18:15:55
"The virus isn't going to disappear, the spread just needs to limit to a point where hospital's have the capacity to deal with patients.  No one is trying to eliminate this through lockdowns.",fowtadl,fowt54j,2020-04-28 22:17:59
