Comments,Comment_Id,Comment_ParentId,Timestamp
There's no way a treatment is ready by the Fall. It takes years to develop a vaccine. And there's never been a vaccine made for coronavirus before either to my knowledge.,foxys81,g9opaq,2020-04-29 07:45:16
"So now experts are 100% percent sure the virus will come back (even though there is no evidence for this, if they have it why aren't they showing it) and kill many more people exactly like sars, bird flu, swine flu did, right? Well sars just went away swine and bird flu are just became seasonal glues after 1_2 years. And everybody talks about how deadly the spanish flu was when it came back but fail to refer to studies proving that a large proportion of people died because of use of high amounts of aspirin used in treatment ( you know aspirin poisoning - the one that gives respiratory and cardiac arrest like the flu) They are 100%sure about this but have basically zero idea about how infectious the virus really is (maybe it's less maybe it's more infectious than they believe). And in the mean time the experts are against antibody testing because they believe the tests are inaccurate ( but they don't believe the same thing about the RT PCR test when for the flu in order to confirm you make blood tests and not PCR) and that for whatever resson even if they were inaacurate that doesn't mean immunity. I agree there is no evidence for immunity (but let's be real for every virus people have at keast a few  a couple of months worth of immunity) and we need to be careful, but knowing the real extent of infection isn't important? They want to surveil people with drones and phonene apps but they don't wanna know that someone who was infected and did not know it may have infected tens of other people thus creating a snowball of infections in a certain area? WTF?",foxfydx,g9opaq,2020-04-29 02:46:42
"Fucking hell, is there any good news? It's getting worse and worse every day and it's making me wonder what's the point of even trying to get through this",foxfxrr,g9opaq,2020-04-29 02:46:27
We must keep the country locked down to protect obese boomers and octogenarians with 5-10 chronic medical conditions. At all costs.,foxf711,g9opaq,2020-04-29 02:35:46
"Don't worry guys, it's going to hit 0 soon!",foxdahe,g9opaq,2020-04-29 02:09:12
"I read this as a ""bad fail"" - which could also be true I guess",foxa7fp,g9opaq,2020-04-29 01:27:39
"Fight this tyranny! If you are American you are obligated to protect freedom and fight. If you don't fight for your rights, you forfeit them. If you don't fight for freedom you are an enemy of mine and all other Americans.",fox82tu,g9opaq,2020-04-29 01:00:22
Fauci said it was nothing to worry about in February.,fox58ap,g9opaq,2020-04-29 00:26:15
https://m.youtube.com/watch?v=A4ga0RyQD4kFauci’s Plandemic exposed by an actual doctor,fox4h8z,g9opaq,2020-04-29 00:17:36
What treatments is he talking about?,fox2pyh,g9opaq,2020-04-28 23:57:49
"Why aren't the States following the Canadian Provincial model of mandated mandatory 2 week quarantine upon entering a province, unless you are essential.It would significantly slow down State-State spread.",fox2hmt,g9opaq,2020-04-28 23:55:12
Can someone provide some proof of this? I keep hearing how bad the fall might be with no facts to support this worst case scenario. It could also be a non-issue.,fox2eq4,g9opaq,2020-04-28 23:54:20
Tocilizumab looks like it might work for cytokine storm. Hopefully Remdisivir can do something earlier in the disease,fowzn3y,g9opaq,2020-04-28 23:23:50
"I don't mind if the US is ""in for a bad fall"".  I hate the USA.  A country with a president Trump is illegitimate and doesn't deserve to exist.",fowzlhx,g9opaq,2020-04-28 23:23:21
"Fall? Am I the only one who thinks we're gonna be in for a bad summer, with this rush to get people back to work and a ""new normal?"" My state has had 1100+ cases everyday for what seems like quite a while now with people ""staying home."" People wanting to get back to work and risk their lives to do so is fucking baffling to me.",fowz6hx,g9opaq,2020-04-28 23:18:55
"Honestly, I'm fucking tired of this fauci guy spewing bad news. Don't get me wrong, I respect him. He's smart. But he gives nothing but bad news. And I'm tired of that",fowz0s2,g9opaq,2020-04-28 23:17:13
"They are really pushing fear to the public with this. By the time fall hits most of America will have had the virus. Unless it evoles dramatically beforehand, which is extremely unlikely, we will be fine. Seriously, stop trying to frighten people, the world isn't ending any time soon folks.",fowxv85,g9opaq,2020-04-28 23:05:17
RemindMe! 5 months,fowxv08,g9opaq,2020-04-28 23:05:13
no shit,fowx81w,g9opaq,2020-04-28 22:58:31
Doctor will say your solution is bad and then just not give a good one.,fowwgmo,g9opaq,2020-04-28 22:50:32
This entire sub is just losers that are happy the world shutdown so they can feel better that they were already inside with nothing to look forward to anyways. You don’t want people to go back to actually enjoying their lives because you don’t enjoy yours,foww6w6,g9opaq,2020-04-28 22:47:43
>in for a bad fall.A double meaning if I ever saw one.,foww5sj,g9opaq,2020-04-28 22:47:23
"Rushing things to get back to normal as soon as possible is just going to make things worse in the long run. Sure, the economy will come back for a while, but then your going to have a huge surge in cases that your going to have to close everything again, then people will die because hospitals will get overwhelmed when their lives could of been saved by waiting more.",fowvide,g9opaq,2020-04-28 22:40:45
"We'll make them fucking work. What is this guy's job after all, preaching to us?",fowv87s,g9opaq,2020-04-28 22:37:51
Translation .... we want this thing to scare you into wanting a mail in election this fall,fowtzaa,g9opaq,2020-04-28 22:25:02
Holiday season is gonna be dark AF this year. Brace yourselves.,fowttgo,g9opaq,2020-04-28 22:23:23
"Treatments, oh yeah like injecting yourself with disinfectant...",fowtalx,g9opaq,2020-04-28 22:18:03
"Fall as in *""fall is my favorite season""*, or fall as in *""rise and fall of the Roman Empire""*?",fowt3ea,g9opaq,2020-04-28 22:16:02
You don't say?,fowsv0h,g9opaq,2020-04-28 22:13:38
I’ve heard this story before.. all the kings horses and men won’t be able to put the US back together again,fowrn69,g9opaq,2020-04-28 22:01:27
Autumn or Rome?,fowr7je,g9opaq,2020-04-28 21:57:09
"Type 1 diabetic and ex smoker here. On day 8 cigarette free and wondering on if I am forced to go back to work, what my decision will be. I live in Texas and was fortunate to be able to work remote, but I know now my company will be forcing us to all come in. Torn between my health and my finances which is an unnerving situation. I will tell them to give me till the 18th as I would like to see how this opening up (without ramping up testing) does to the case rates. If ok, then I will come back in. I just don’t see how it will be ok considering Texas is 49th in testing and is terrible with case tracing. I feel like the upper powers that be have just accepted that this is what it boils down to. Texas has pretty much found away to not pay unemployment either by opening up at 25%.",fowpxnd,g9opaq,2020-04-28 21:44:54
"I live in Houston and work in research at a cancer hospital. The emails sent today are laying the groundwork for return earlier than the May 1st date we were given a few weeks ago. They say they're going to monitor the data as the process proceeds, but I'm afraid we're about to undo a lot of what has been done to stop the spread.",fowpwmh,g9opaq,2020-04-28 21:44:37
!RemindMe 5 months,fowpaki,g9opaq,2020-04-28 21:38:50
POTUS said it will over by fall.,fowpa3u,g9opaq,2020-04-28 21:38:42
Yah pretty much goes without saying.,fowohg8,g9opaq,2020-04-28 21:31:04
Ohhh a “could be” and an “if” in one headline.,fownod7,g9opaq,2020-04-28 21:23:19
Fear mongering is the new norm,fownirg,g9opaq,2020-04-28 21:21:48
"""there is no treatment.""  - my doctor, todaythankfully it seems unlikely that I have it, but let's get real here.",fowmjqv,g9opaq,2020-04-28 21:12:20
Georgia opening early is good for the country. We can all sit back for a month and see what happens. One way or another we'll be smarter.,fowm1g7,g9opaq,2020-04-28 21:07:22
Where are we with regards to the antibody plasma treatment?,fowl3f0,g9opaq,2020-04-28 20:58:22
We'll all be dead by then anyway.,fowkshm,g9opaq,2020-04-28 20:55:25
"Funny, Fauci is probably being told he’s in for a bad fall if he doesn’t stop criticizing the US’s handling of the virus....",fowko4m,g9opaq,2020-04-28 20:54:16
I feel like we are gonna be in for a bad summer if states open up too soon.,fowkdua,g9opaq,2020-04-28 20:51:34
Duh,fowka19,g9opaq,2020-04-28 20:50:34
Man just tell these asshole not taking it seriously that it’s going to fuck up Christmas and they’ll sit their asses home.,fowjcnd,g9opaq,2020-04-28 20:41:53
"The only place that has infections higher than antibody test noise is New York. From that study, Ifr came out to just over 1 percent. (Your not going to convince me that people who did not die in a hospital somehow does not get counted) That’s well over two million fatalities in the United States if we all pretend like this is not happening.Assumptions. R0 3+ 75% herd immunity 1 percent ifrPlease tell me why I’m wrong. I think a lot of people are forgetting why we are sheltering in place. I think there has been a tremendous amount of misinformation on the risks a reasonable person could calculate on the back of a napkin. It feels like there are some callous efforts made by a group of people who has accepted this number of fatalities, but has not been forthcoming about the realities of our predicament. I’m tired of weekly talking points. These have been proved misinformed, or misleading time and again. (Don’t think I even need to provide examples, it’s obvious to most)We need a real debate in this country first. Serious experts without an agenda say we are in this the the long haul and this is just getting started. To ignore these numbers is to ignore the true risks. It’s literally like taking a stadium full of people, and a bomb kills 800 - and repeating that 3,200 times across the country. We need to ask ourselves if that what we are willing to do to other people (and yourself) before we make any sort of collective decision to say “fuck it, I’m going to the beach.”You can tell me that I’m wrong, I wish the very real possibility did not exists...but to ignore the possibility is lunacy.",fowj9m1,g9opaq,2020-04-28 20:41:05
Fauci just needs to STFU already with his doomsday prophecies. 1 in 3 New Yorkers have already HAD this virus. He needs to get out of his Victorian DC mansion and spend a few days at ground zero in order to prophecize his idiocy. The worst is over and the more people that  get this virus means fewer it will spread to.,fowj2nf,g9opaq,2020-04-28 20:39:17
A bad fall and summer is a given with the amount of people leaving isolation. A lot of people in my state are out and about like it’s no big thing even though we are still under state mandated stay at home orders. Other parts of the country are worse. We’ll be entering a second wave before we finish the first one.,fowiadt,g9opaq,2020-04-28 20:31:57
"Stop issuing warnings and focus on testing. Jeez, our so called experts are about as useless as the politicians.",fowgdbn,g9opaq,2020-04-28 20:14:06
It’s weird how Dr Fauci predicted Trump was going to face an unexpected virus in 2017https://www.healio.com/infectious-disease/emerging-diseases/news/online/%7B85a3f9c0-ed0a-4be8-9ca2-8854b2be7d13%7D/fauci-no-doubt-trump-will-face-surprise-infectious-disease-outbreak,fowg164,g9opaq,2020-04-28 20:10:57
Predictions aren't facts.,fowfpcy,g9opaq,2020-04-28 20:07:56
[removed],fowfo54,g9opaq,2020-04-28 20:07:38
> Regulation can be a converted Albertson's even.,fowfe0e,g9opaq,2020-04-28 20:05:02
[removed],fowfci2,g9opaq,2020-04-28 20:04:38
Perfect for r/illegallifeprotips,fowf7lf,g9opaq,2020-04-28 20:03:25
"There will be a sudden spike in 1 month and then we will be shut down again. If you look at the 1918 Flu, this is exactly what happened and again shows what happens when people don't read or understand history. Our only hope is that masks save us and social distancing has sunk in among the population.Unfortunately in the US, we also don't have a lot of central control by the Feds, by design I would argue, and this is a real Achilles heal for this nation. We have no national plan, not many regional plans, just printing more and more money to bail out people and businesses. Even if Biden wins, he's not competent either and too old. And the blue team won't get sworn in till Jan 20th. It would take at least a month to get going so by Feb 20th, 2021 maybe we'll have a national plan working but by then we may have 150,000 dead.",fowepz2,g9opaq,2020-04-28 19:58:53
I’m done caring,fowe6fg,g9opaq,2020-04-28 19:53:58
[removed],fowdt90,g9opaq,2020-04-28 19:50:40
"But guys, Dr Erickson, who no one has ever heard of, says that it's all an overreaction, so clearly he's right, right?",fowdrf0,g9opaq,2020-04-28 19:50:12
[removed],fowdkev,g9opaq,2020-04-28 19:48:28
What treatments?  He hasn't mentioned a one.  We're the only country doing nothing.  He's given no guidance toward any treatment except to shit on treatments the rest of the world are already using.  Fauci should be fired...out of a canon to France.,fowclbd,g9opaq,2020-04-28 19:39:36
"Call your lawyer and write your will folks. I’m not being sarcastic, my hope for a better tomorrow has been draining day after day and the level of stress is slowly killing me mentally. I’m a student and my university is planning to host in-person lectures this fall. I really want to believe that we will be in a better shape by then, but I just couldn’t. I’m scared, send help.",fowch84,g9opaq,2020-04-28 19:38:35
I think people are forgetting that vaccines aren’t 100% guaranteed.,fowc31g,g9opaq,2020-04-28 19:35:00
[removed],fowbmc7,g9opaq,2020-04-28 19:30:51
The US response has been largely a disaster at the Federal level and the state responses are varying widely. Expecting the US and Brazil to be the epicenters of this for a while.,fowaw9r,g9opaq,2020-04-28 19:24:19
"Careful, that’s what orange prince disgrace WANTS. He does NOT give a shit about ANY of you/us.",fowavcp,g9opaq,2020-04-28 19:24:05
it's gunna get real fuckin bad. I live in the mid west and ever since last friday people have been out and about almost at normal levels. Today I was in my first traffic slow down since the lockdown started. It's really giving me the concerns.,fowaopg,g9opaq,2020-04-28 19:22:25
It won't be a very holly jolly Christmas this year.,fowagz2,g9opaq,2020-04-28 19:20:30
"I love all these ""could be"", ""if"", ""model"" articles... Im making so much fucking money off stocks that got hammered because of the overreaction.",fow8y3l,g9opaq,2020-04-28 19:06:51
"Fauci is an idiot, what happened to the 300,000 deaths by april",fow8wfu,g9opaq,2020-04-28 19:06:27
What are the chances we'll even have a vaccine. There are plenty of diseases where there is no available vaccine.,fow89zz,g9opaq,2020-04-28 19:00:52
Meanwhile here in my local county people dont think its bad at all and that all the numbers have been fudged to make it seem worse because no one has seen any of the devastation first hand other than being laid off work for a month now.,fow76vs,g9opaq,2020-04-28 18:51:20
"All right everyone, just make sure to completely spam the shit out of the subreddit with the same responses there are in literally every single thread. ""X # of CONFIRMED cases. Who knows how many there are! We need more testing.""FFS guys, we understand.",fow71q5,g9opaq,2020-04-28 18:50:04
I dont believe this at all.,fow71ab,g9opaq,2020-04-28 18:49:58
Fire fauci,fow6vo1,g9opaq,2020-04-28 18:48:36
[removed],fow6tt6,g9opaq,2020-04-28 18:48:09
They're going to open everything back up and the vast majority of people are not going to spend / go out like they used to anyways... For a while.,fow6rhz,g9opaq,2020-04-28 18:47:34
I work on construction sites that are going to start cramming 30 people in confined spaces together starting Monday...as essential gotta finish building projects (one is a museum)....and none of the trades people observe precautions well....half of them don’t think there’s anything to the issue...the others are too stupid to understand or just afraid to speak up....and the contractors and the owners want it all to go away and be back to normal...,fow6ny1,g9opaq,2020-04-28 18:46:44
The tittle forgot to say that Ice is cold and that fire burns. Also forgot that water can make things wet. ;-),fow5vwk,g9opaq,2020-04-28 18:39:49
"The more I see this types of articles, the more I realize lots of places are running out of important stuff to say. ""If I stub my toe, then it hurts...""-CNBC""If I don't treat a wound.. it could get infected..""-Fox News. ""The.. The guy who's moves faster is the one who is running.""-Trump probably.",fow5ti1,g9opaq,2020-04-28 18:39:14
How are they going to enforce social distancing of 200M people in breadlines? Have they announced that yet?,fow5sua,g9opaq,2020-04-28 18:39:04
"I misread that as ""bad fall of the empire"" instead of ""bad autumn"" for a bit",fow5r3v,g9opaq,2020-04-28 18:38:39
"Anyone who thinks my entitled technology-job-working self is coming into the office anytime soon, when cases are rising and my state ranks 50th for testing, can go ahead and eat my ass with a spoon. And I’ll do what I can to fight for others who may be less able to stand up to them.",fow56cc,g9opaq,2020-04-28 18:33:32
[removed],fow537i,g9opaq,2020-04-28 18:32:46
Let’s see if this disinfectant idea from Trump works - surely that’ll save us all,fow4y6k,g9opaq,2020-04-28 18:31:32
Can somebody please shut this guy up?,fow4ubc,g9opaq,2020-04-28 18:30:35
"My girlfriends parents are driving into the city on Monday to drop off their youngest daughter who won't reveal she has a significant other, but says she ""has"" to go back to throw out spoiled food and get stuff from her apartment in the heart of NYC.Additionally they're gonna go BACK and pick her up on Wednesday, and on the way back stop in Brooklyn to see her 90 year old grandma. My girlfriends dad is immunocompromised, and her mom is 60. They're literally asking for it.",fow4i9w,g9opaq,2020-04-28 18:27:42
"I interpreted ""a bad fall"" as in ""I've fallen, and I can't get up"", not the season otherwise known as autumn.",fow3z06,g9opaq,2020-04-28 18:22:58
Putin gunna give idiot a big bonus this year.,fow3rts,g9opaq,2020-04-28 18:21:11
"Yes, indeed. He is correct. There is nothing like hubris.",fow38oc,g9opaq,2020-04-28 18:16:31
You mean the same guy who predicted 200k dead by 2 weeks ago? Fuck this snake oil salesman,fow33y5,g9opaq,2020-04-28 18:15:22
"Trump looks sad in the picture thinking ""darn I'm smart too I should've became a scientist. He's getting all the attention. Maybe if I look at him and try copy his words and hands more people would like me and forget I told them to drink bleach. Maybe they'll vote for me as sexiest man alive.""",fow2vnx,g9opaq,2020-04-28 18:13:22
It turns out it was just one big wave we could never get off hang ten my friends it’s about to get stormy,fow2jgg,g9opaq,2020-04-28 18:10:26
"If there’s a much more early second wave of the Coronavirus then the United States is well and truly screwed, they’re doing beyond nothing to stop it",fow208h,g9opaq,2020-04-28 18:05:48
How many times does he have to reiterate this ?? It’s frustrating how it feels like no one is hearing him out,fow1uwr,g9opaq,2020-04-28 18:04:30
Well duh.,fow1tju,g9opaq,2020-04-28 18:04:11
I am reminded of V for Vendetta where they mentioned that the plague ravadged US rejected another food relief shipment.Maybe that is somewhat prescient.,fow1k1y,g9opaq,2020-04-28 18:01:55
Essentially. To be fair.... I’d uninstall.,fow1416,g9opaq,2020-04-28 17:58:08
We totally won’t read.,fow0zhk,g9opaq,2020-04-28 17:57:03
"What's the current ""treatment"" anyway? Since there's no cure I can only imagine it's treating the symptoms",fow0x7o,g9opaq,2020-04-28 17:56:30
[removed],fow0vk0,g9opaq,2020-04-28 17:56:06
"I'm just starting to realize how long this might go on until. I don't think this is gonna be over within the time span of ""weeks"" anymore, more like several months.Extremely saddened.",fow0my6,g9opaq,2020-04-28 17:54:05
This guy's predictions have been pretty off. So far the flu has been worse in terms of people that die.,fow0mgc,g9opaq,2020-04-28 17:53:58
[deleted],fow04nu,g9opaq,2020-04-28 17:49:44
No shit Sherlock. This would be like an NFL coach is asked about his matchup with the KC Chiefs and they responded with “if our pass defense is not there it could be a bad game for us”. Yeah no shit because the other team has Pat Mahomes.,fow02eo,g9opaq,2020-04-28 17:49:14
Thanks Dr. Obvious,fovzzrs,g9opaq,2020-04-28 17:48:38
"In other news, Dr Fauci warned that if you don't have a good day tomorrow, you may be in danger of having a bad day.",fovzxxx,g9opaq,2020-04-28 17:48:12
"I just don't see why employees aren't being made to wear masks. Two people at my work had Covid-19, and my work doesn't even take temperatures of employees as they enter, yet sends us out in a truck together for the day. And I work in local government. Not some private sector job",fovzmbu,g9opaq,2020-04-28 17:45:27
The internet should change this guy's name to Dr. Doom.,fovz8kz,g9opaq,2020-04-28 17:42:13
RemindMe! 4 months,fovz0i7,g9opaq,2020-04-28 17:40:20
"You know I have absolutely enjoyed staying at home but even I am starting to get tired of this.  Sweden has shown us that masks work.  Because if you didn't know, Sweden has only mandated social distancing, not masks, and they're getting hammered by the virus.  Idiots, I tell you.  Go outside, wear a mask, keep away from others and you will be fine",fovysqe,g9opaq,2020-04-28 17:38:32
Yeah unemployment is shit right now. If things don’t get better. People are going to freak out.,fovypmo,g9opaq,2020-04-28 17:37:48
Hmm,fovyfad,g9opaq,2020-04-28 17:35:23
"Remember when Fauci said that COVID-19 is about as dangerous as seasonal flu? I remember. He said it in the New England Journal of Medicine back in March.Which is it, Fauci?",fovyejs,g9opaq,2020-04-28 17:35:12
"Wait, will the pumpkin spice supply line be disrupted? Asking for a friend....",fovycsk,g9opaq,2020-04-28 17:34:47
"Posts about Fauci everyday, why does he warn everyday? Like, once in a week shall be enough i guess...",fovxwzl,g9opaq,2020-04-28 17:31:03
Fuck this incompetent stooge.,fovxutn,g9opaq,2020-04-28 17:30:33
lol. if.,fovxu9b,g9opaq,2020-04-28 17:30:25
A) CancerB) Heart AttackThose are the options.,fovxf3w,g9opaq,2020-04-28 17:26:51
Speech Language Pathologist here... with all of these people going on vents. It won't be just surviving COVID that will give you a bad day. It will be all of the side-effects that are a result of being intubated or put on a vent. It fucks you up cognitively.,fovwzvv,g9opaq,2020-04-28 17:23:15
"Why does everyone think that the fall is going to be bad? It’s going to be bad in about three fucking weeks due to everything opening back up prematurely. Here in Alabama, Governor Meemaw has decided that we’re pretty much good to go. Retail stores can open up to 50% capacity. Who’s going to enforce that? The managers at the electronic stores who don’t even raise an eyebrow when you walk through the door? Or the kid who makes $9.41 cents an hour who has homework to finish when he gets off? Is he supposed to be responsible for the health and safety of everyone? Beaches here will be open on Thursday again, too. Just make sure that there aren’t groups of more than ten people together. Who at the beach is going to be responsible for enforcing that? It’s such a good thing that the coronavirus makes sure to count the number of people in your party before infecting you. I thought we had ten folks here, thank the lord that there’s only nine of us! Dodged a bullet there, buddy. Pass me a cold one!This thing isn’t waiting until pumpkin spice season to continue spreading. It’s not hanging at Daytona with its friends. We are unnecessarily putting peoples lives in jeopardy because the 1% aren’t getting that steady stream of cash that they’re so accustomed to.",fovwz3g,g9opaq,2020-04-28 17:23:05
"IDU.  China or South Korea  restored some openness in late Winter, early spring.  They have the same treatments that we do. Why haven't they suffered then?",fovwv4z,g9opaq,2020-04-28 17:22:10
Anyone else tired of posts like this? I can’t be the only one who does not care about what people think about the fall - it’s 4 months away. It’s just fear mongering to me and I come to this subreddit for some news but all the upvoted stuff is this crap.,fovwsng,g9opaq,2020-04-28 17:21:34
RemindMe! 5 months,fovwev3,g9opaq,2020-04-28 17:18:19
This guy is a joke #ReOpenAmerica,fovw92p,g9opaq,2020-04-28 17:16:58
well yeah no shit,fovvqs1,g9opaq,2020-04-28 17:12:44
"People who get over the bug are immune *at that time*. What does that mean? I mean, they are getting over it, aren't they?",fovvpca,g9opaq,2020-04-28 17:12:24
"Meanwhile the President and the country's CEOs and multi-millionaires + : ""Fuck the poor! Send them back to work, don't care: I want more money! Fuck the poor, what good are they, who cares if they die, I want my money right now!""",fovvoh5,g9opaq,2020-04-28 17:12:12
>could>ifUse reading comprehension and stop interpreting everything as we’re fucked lol.,fovvk6i,g9opaq,2020-04-28 17:11:12
When is it reality vs frightening people?  When does a leader have an obligation to prepare yet offer hope?,fovvc4v,g9opaq,2020-04-28 17:09:19
Inb4lock - we all know what is gonna happen here,fovuvmv,g9opaq,2020-04-28 17:05:32
