Comments,Comment_Id,Comment_ParentId,Timestamp
"Is your mental health suffering from effects of the actual virus or from the stresses of the media, economy, shut down, etc?",fow2a6w,fovoit4,2020-04-28 18:08:14
Hang in tight bro. You’re not the only one.,fovzt3b,fovoit4,2020-04-28 17:47:03
Are you an extrovert?,fovzbnp,fovoit4,2020-04-28 17:42:57
It's a marathon rather than a sprint. Try to accept and adapt. I made a few changes that cut pretty deep in my flesh but they make this situation better to handle.,fovz5mm,fovoit4,2020-04-28 17:41:31
"Yeah for me trying to be productive for 40 hours working from home a week with two kids under 5 is driving me nuts.  It's hard to shed the expectation that we need to get as much done each week as we did before this started, that weighs heavily on a lot of  people.",fovy9ep,fovoit4,2020-04-28 17:34:00
Dittttto! I'm a social person and living in 4 walls has got me going crazy.,fovx2gp,fovoit4,2020-04-28 17:23:52
Same. This is terrible.,fovovo9,fovoit4,2020-04-28 16:16:22
It’s not the greatest written title but it works. I’m more concerned with how it feels like every doctor who makes $120k+ doesn’t seem to care that the lockdown is shredding people’s finances.,fovohpg,fovobbh,2020-04-28 16:13:09
"Your comment has been removed because* **You should contribute only high-quality information.** We require that users submit reliable, fact-based information to the subreddit and provide an English translation for an article in the comments if necessary.  There are many places online to discuss conspiracies and speculate. We ask you not to do so here. ([More Information](https://www.reddit.com/r/Coronavirus/wiki/rules#wiki_rule_5.3A_keep_information_quality_high))*If you believe we made a mistake, please [message the moderators](/message/compose?to=/r/Coronavirus).*",fow8rnb,fovnpz8,2020-04-28 19:05:15
> and a less than zero chance of dying from it in NYYou have a negative chance of dying from it in NY? So it's actually resurrecting the dead?,fovxnfo,fovnpz8,2020-04-28 17:28:48
[removed],fovowu0,fovnpz8,2020-04-28 16:16:38
"You go broke if you die, FYI.",fowal10,fovn3dz,2020-04-28 19:21:31
">Respectfully speaking though, Dr. Fauci, and many other doctors, aren’t affected by the financial aspect of the shutdown as much as some people are.When getting health information, I'd like to get it from someone who ISN'T influenced by money.  I like the truth in it's least monetarily-varnished form.I can then make my choices and voice my concerns.",fow743f,fovn3dz,2020-04-28 18:50:39
Public health experts give the best of their advice knowing that it will need to be weighed against other sociopolitical ideas.,fovyxw8,fovn3dz,2020-04-28 17:39:43
"Dr. Fauci is not working for wall street. He is a medical doctor putting out the truth that without a cure, coronavirus is not going to disappear.If all businesses try to go back to normal in the next month or so there will be a big second wave of cases. Nobody likes that but not liking it doesn't change facts.",fovpof3,fovn3dz,2020-04-28 16:22:52
"Your comment has been removed because* **Incivility isn’t allowed on this sub.** We want to encourage a respectful discussion. ([More Information](https://www.reddit.com/r/Coronavirus/wiki/rules#wiki_rule_1.3A_be_civil))* **Purely political posts and comments will be removed.** Political discussions can easily come to dominate online discussions. Therefore we remove political posts and comments and lock comments on borderline posts. ([More Information](https://www.reddit.com/r/Coronavirus/wiki/rules#wiki_rule_4.3A_avoid_politics))*I am a bot, and this action was performed automatically. Please [contact the moderators of this subreddit](/message/compose/?to=/r/Coronavirus) if you have any questions or concerns.*",fovmwfj,fovmwdm,2020-04-28 16:00:14
"> We get more testing - which is doubtful considering our country doesn't seem to have a plan to galvanize industry to provide more raw materials and manufacture the tests, unlike other countries one which has developed a 1 minute test.Pisses me off that he won't use the Defense Production Act for masks, gowns, ventilators, or test kits, but he's right there cranking up the DPA as soon as something even *remotely* threatens the supply of hamberders.> We get more PPE - again, doubtful considering the USA regime's plan is for FEMA to seize PPE meant for the States, unless they have politicians, reporters and the hospital at the airport when the PPE landsTelling states and hospitals that they're on their own to get new PPE, stealing the new PPE when it comes in, stealing the *old z PPE if they think you don't need it, selling stolen PPE real cheap to GOP benefactors so the benefactors can officially sell it at a drastic markup, *giving away* stolen PPE to foreign countries.What's that line - ""It's not the states' PPE, it's our PPE and we'll do what the fuck we want with it"".",fowmvhe,fovhpie,2020-04-28 21:15:27
"We have a lot of reason to believe that immunity is there and no real reason to believe it isn't. Immune doesn't mean unable to be reinfected, it means unlikely to be reinfected and will experience a very swift, mild form of the illness if so. Also, the body's immune response can fail for all sorts of reasons which is why 3% of people immunized for measles would still develop measles if exposed - but that means 97% will not, which is important for preventing outbreaks.The WHO's statement about immunity was irresponsible. Absence of evidence is not evidence of absence, and we do have a lot of indirect evidence. For example, families. One person gets it, then spreads it to their family but only after a few days. So you know one of them will recover while others are still infected. Why aren't they all perpetually reinfecting each other if this is so contagious and immunity isn't a thing?What we don't know is how long it lasts. It's a few months for a cold and years for SARS, Fauci said he expects immunity to this virus to be somewhere in between, so a couple of years. That means it'll last long enough for us to get a vaccine out.Ok, downvote me but virologists agree with this. [https://www.n-tv.de/wissen/Drosten-Genesene-Corona-Patienten-immun-article21746354.html](https://www.n-tv.de/wissen/Drosten-Genesene-Corona-Patienten-immun-article21746354.html])",fow0frb,fovhpie,2020-04-28 17:52:23
"For 3, immunity, with antibodies and all that, is the process by which the body expels a virus. If someone genuinely recovers from covid-19, they are by definition immune. What we don’t know is how long that immunity lasts, or how effective it is against varying sizes of viral loads, which is why WHO came out with that comment last week- likely in an attempt to dissuade countries like Sweden from pursuing herd immunity, and to keep Germany and Italy from relying too much on immunity cards. Of course, as this is a virus, we have every reason to *expect* that a recovered person has immunity for a substantial period- there is currently no evidence against that, but as this is a novel virus, we can’t say for certain without evidence explicitly confirming that. Best not to base policy decisions on expectations and assumptions. As for 4, honestly we can’t know about long term effects until at least after a year- the pandemic may well be over before we understand that. Most of the things you mentioned are aspects of any kind of severe respiratory disease, including flu like illnesses. From the evidence we have so far, we can say that these are very rare outcomes for flu-like illnesses, and very rare outcomes for covid-19.",fovtkd4,fovhpie,2020-04-28 16:54:41
6 months? We will be on wave 3 by then.,fovpy2f,fovgkqk,2020-04-28 16:25:04
">I am hoping that by June, the places that ""re-opened"" early, will be seeing a spike in cases so bad that it can't be covered up or lied about, and saner heads will prevail.So you hope for more people to get sick and die so you can say ""I told you so"" rather than hoping for no spike, increased health across the board and your doomsday prediction to be wrong? Yikes, you should be ashamed.",fox919q,fovge5r,2020-04-29 01:12:31
The nitwits who want to keep everything shut down until the end of time are going to kill people too.,fow4dbl,fovg5qg,2020-04-28 18:26:30
"What scares me is the thought that the Trump administration might be in charge of the vaccine administration, if and when one is found. If you live in a state that did not vote for him (even if results were 51% v 49%) you will be last to get available vaccines. He has already shown/said numerous times that he has no problem with demanding obeisance and demanded public accolades from states if they expect assistance. His administration has been blatantly vindictive on this basis. This is a real concern.",fowisi0,fovftac,2020-04-28 20:36:38
"Did you hear Trump a month ago that the scientists told him “this thing will flow through the population”. Those weren’t his exact words but it created the mental image of a wave washing over a shore. Once it got out of China, it was on. There is no stopping it. We are just trying to stop from drowning our healthcare system. The media is giving people false hope about it being safe if you lockdown long enough.",fow97t2,fovftac,2020-04-28 19:09:18
But much much worse doesn't mean OMG EVERYONE DIES.,fovx1qq,fovftac,2020-04-28 17:23:42
"There is always hope. The German study I saw the other day argues that the immunity from the common cold coronavirus (usually lasts 3 months) can provide partial protection against covid. If this is verified and confirmed, this could be the miracle drug we are looking for. Infect the general population with the known virus which has almost 0 mortality rate and gain partial immunity against covid.Even if this doesn't work, a lot scientists are working on it and we will have better treatment in the future.",fovtf45,fovftac,2020-04-28 16:53:31
"Not staying home isn't selfish, for many people it's a matter of their entire livelihoods.",fox8ihj,fovfksn,2020-04-29 01:05:52
Remain relevant? I think your presidents attention boner has penetrated your thought process. Fauci is a doctor. Not a reality tv personality like your president.,fowfz9b,foveh81,2020-04-28 20:10:28
"I don’t think anyone is wishing for this to be bad. Everyone, on both sides, wants this to get better",fovz7z4,foveh81,2020-04-28 17:42:05
No. And that was never the plan behind a lockdown.,fox8juj,fovcmlw,2020-04-29 01:06:21
Okay but remember vaccines aren’t 100% guarantee you won’t get it. I think people are skipping over that.,fowc0m6,fovcmlw,2020-04-28 19:34:25
[removed],foxxy7r,foxldoz,2020-04-29 07:33:14
"That's not what I asked. We have no more evidence to support a disastrous fall than we do that this death rate is much more than the flu. One day you can get it from your groceries and the next you can't. We have the hospital capacity and resources to avoid shutting down the economy, at least to this length. Chicago alone has a few thousand beds set up they didn't use. The whole point of quarantine was bc of hospital capacity, not bc of people getting sick. You ultimately can't avoid people getting sick. No reason states shouldn't be going back to work given resources can handle more patients",foxu9u1,foxlgjc,2020-04-29 06:35:04
Yeah. This guy is limited to speaking about the US. And there's nothing but bad news there,fox3qt7,fox1y28,2020-04-29 00:09:19
I like ur attitude bruh😂,foxksz5,fox6er2,2020-04-29 03:59:10
We have adult supervision here in Maryland. Opening schools is really stupid.,fowvftg,fowsuox,2020-04-28 22:40:01
"It’s from the latest New York study. There are many of these antibody tests, most of which the results not rising above the noise generated by the tests themselves...they are basically worthless and mostly used for misinformation at this point.  The New York study is a bit different because the number of people who have measured antibody is higher then that noise floor. The test produced a range of ~.8-1.09...in NYC. If you count people who died at home. This guy breaks it down a bit more, but to prove the opposite viewpoint from my own. https://finance.yahoo.com/amphtml/news/time-consider-herd-immunity-york-011655336.html",fowuug9,fowrfv0,2020-04-28 22:33:56
"I agree these are all problems, but I don’t agree that they are dichotomous. This problem is multi faceted. There are possible solutions, none that are impossible. 1. A life on hold, for a life saved (and many more due to chain infection)? I would gladly do it personally...if that’s what I gotta do. Some people would probably disagree, but I’d hope not.2. Most of the world’s grains goes to feeding livestock, and the livestock is consumed mostly by people in developed countries. Would it be a sacrifice by the developed world to eat 70 percent less meat for a year+ to feed people in a famine as a result? Yes. Is it a major sacrifice? Probably not...but depends on who you ask. I’m no vegetarian, but I would do it if it could help us get out of this mess.3. Would offer to have an in-law move in with you to assist with their domestic abuse situation? I think a lot of people would. So here is the scenario to the argument: Eat seventy percent less meat, while you live with your in-law and are bored because your life is on hold- but maybe that would be a good time to plant a potato patch to help? (it was done all over the United States during Spanish flu)WWII was a much bigger sacrifice for all involved. Ration books, sending your kids to war, a whole new generation of women entering the workforce for low pay...the list goes on. Just because a problem seems big does not make it insurmountable, but we need to understand that it will take sacrifice. I’m worried that its not going to even be attempted.(I know there are many more problems, but I’m including the 3 you mentioned. But Lets not forget letting the pandemic burn through certainly has its own, including the above mentioned)",fowp0tt,fowlfxl,2020-04-28 21:36:13
"Please tell me which President shut down the country, because I don’t remember that happening",fowktp8,fowiiq4,2020-04-28 20:55:45
This was not purely political. Get out of here.,fow1780,fow0vsp,2020-04-28 17:58:52
Oh fuck off,fowbwak,fow9v8e,2020-04-28 19:33:19
No. I remember him predicting a much higher infection rate and death count.,fowitoe,fowg4mv,2020-04-28 20:36:57
"Even if the CFR is that low, it still sucks if everyone gets it. He’ll probably be within an order of magnitude if you call that number the IFR. It’s definitely still true that SARS2 is more similar to seasonal influenza, than MERS/ogSARS. And it’s true that Fall is going to suck if we open everything up without being careful. The “Which is it?!” question seems founded on misconceptions.",fowbquf,fow5kev,2020-04-28 19:31:58
That deeply saddens me,fowx95z,fowwyul,2020-04-28 22:58:49
Brain damage essentially,fowvodx,fowrsta,2020-04-28 22:42:27
This article isn't new: https://www.google.com/amp/s/amp.usatoday.com/amp/2912441These articles are:https://www.npr.org/sections/health-shots/2020/04/21/840343240/after-the-icu-many-covid-19-survivors-face-a-long-recoveryhttps://www.sciencemag.org/news/2020/04/survivors-severe-covid-19-beating-virus-just-beginning,foww8cd,fowr8n4,2020-04-28 22:48:09
A study was recently released about long-term cognitive decline far after release from an ICU. Lemme see if I can find it again.,fowro9k,fowr8n4,2020-04-28 22:01:44
"I never hear this mentioned. If social distancing is still being practiced one would expect it to be less transmissible. Given a normal flu has an R0 of around 1-2 and social distancing reduces that, wouldn’t we expect a less deadly flu season since it won’t spread much? Not saying this is a reason to be less cautious now.",fox6t3h,fow4p63,2020-04-29 00:45:03
Maybe people will actually get flu shots this year. It’ll be even more important than normal!,fowc0sg,fow4p63,2020-04-28 19:34:28
"I mean...there’s logistically no way the government can or will be willing to keep people at home for much longer. I think that if they do not come up with something in the next couple months, it’ll be stay at home if youre immnoconrpomised but normal life (with masks) for the rest of the pop.",foxz9w9,fowltvi,2020-04-29 07:52:14
"And thats my problem with this sub...so many sensationalist articles reach the top to the point where its pointless coming here.  I don’t even see the value in posts like this because it’s (a) common sense, (b) provides little to no value, (c) fear mongers/makes people more anxious.",foxz26u,fowh5ec,2020-04-29 07:49:11
"4 months is nothing in normal times, but feels a lot longer in pandemic times. Also, this thing has been around for just barely over 4 months and it changed the world...so yeah ... it’s hard to project whatll happen in the future.",foxz4zp,fowcor4,2020-04-29 07:50:18
It’s annoying because some of us actually come here for useful news. But it’s always buried in useless bs like shit.,fow13m1,fow0zwj,2020-04-28 17:58:02
"There’s no great evidence that this is happening, or if it is, that it would be common. It would be pretty unusual for most recovered people to not be immune, at least for the length of time we’ve been dealing with so far.",fowd48b,fow5vm2,2020-04-28 19:44:24
That is not good. A best case scenario in that situation would be where you get yearly vaccines that work for...a year.,fow6q2i,fow5vm2,2020-04-28 18:47:13
"So the immunity drops, I presume.",fow60ck,fow5vm2,2020-04-28 18:40:56
https://www.youtube.com/watch?v=Lze-rMYLf2EHere's another expert. Pretty much everyone but Fox News refused to have him on.,foxb84k,fows6pn,2020-04-29 01:41:03
So New Zealand should expect a resurgence cause it’s about to be fall there now?,fow5shq,fovz2fa,2020-04-28 18:38:59
"This is what he said. March 29th. My mistake, it was 100-200 thousand people, this was AFTER we started distancing and shutting everything down:  [https://www.npr.org/sections/coronavirus-live-updates/2020/03/29/823517467/fauci-estimates-that-100-000-to-200-000-americans-could-die-from-the-coronavirus](https://www.npr.org/sections/coronavirus-live-updates/2020/03/29/823517467/fauci-estimates-that-100-000-to-200-000-americans-could-die-from-the-coronavirus)",foxx3hq,fovz9w1,2020-04-29 07:20:20
And yet there is a lot of very good research suggesting they are talking out of their ass. [https://abcnews.go.com/Health/south-korean-studies-suggest-antibodies-protect-covid-19/story?id=70312111](https://abcnews.go.com/Health/south-korean-studies-suggest-antibodies-protect-covid-19/story?id=70312111),foxozpt,fowqu8x,2020-04-29 05:06:27
It's my right as an American to be reinfected. I'm glad to see the virus is following the guiding hand of the Constitution.,fox9wl4,fowqu8x,2020-04-29 01:23:42
And it would be better on your body to not be fighting both at once.,foxeytv,fowjnaw,2020-04-29 02:32:32
"Thanks for reminding me friend ! And you remember to take your shot of bleach today as well ! 🤣😆😂 You sound like a well informed IDIOT. Let me guess, you probably watch fox (news) don’t you ! 🤣🤣🤣",fovyc7z,fovtpga,2020-04-28 17:34:39
We'd all be dead? Seriously ALL of us? You're a fucking doomer idiot spreading fear on purpose. You know very well nowhere near ALL of us would die.,foy7w8x,fowvt2q,2020-04-29 09:35:02
"I was probably here before you. There was ""peer reviewed"" research saying the death rate was 2-3%. It was utter bullocks. Most countries are not on lockdown and are fine.",foy5yr3,fowvt2q,2020-04-29 09:14:40
>peer reviewedReddit just learned this phrase in the last 2 weeks.,fox86tf,fowvt2q,2020-04-29 01:01:44
"Herd immunity assumes around 90% of the population is immune. With that IFR, how many fatalities would that be if 83-90% of the population caught it?",fowdeb7,fow7ewc,2020-04-28 19:46:56
"I just have a dog and it’s challenging, but not the living hell you are dealing with — stay sane.",foxp2wj,fovy9ep,2020-04-29 05:07:57
"I hear you with two toddlers myself. This is week 7 working from home. My company has not shut down (defense industry), so while I realize our operations continue, it’s pissing me off how our leadership acts like it’s just business as usual right now. Some of the shit we’re still doing just doesn’t seem important anymore, but it never ends. It’s very tone deaf and insensitive in my view.",fox22i6,fovy9ep,2020-04-28 23:50:32
"In a similar boat with added bonus. My manager is an empty nester who's a workaholic and the rest of my team has no kids. I still have a job, so I'm better off than most so can't really complain.  Also get to watch my kids grow up right in front of me, so that's pretty good too.",fox0p08,fovy9ep,2020-04-28 23:35:10
"Same boat. Kindergarten was supposed to start this fall and now I'm deeply concerned that won't happen. I don't have a teaching bone in my body, rather seem to be a skilled anti-teacher. Both kids can't be in a room together and stay focused. My god, how can I be a teacher individually to two 5 year olds and work full time?",fowr220,fovy9ep,2020-04-28 21:55:38
I just let my work know I would need to take some time off for family leave to watch the kids via the cares act.,fowfahz,fovy9ep,2020-04-28 20:04:08
Sorry to hear that buddy. I've got two under 2 but have some help so I sort of understand.  It's really hard to get 40 hours in. Keep strong.,fovyjo2,fovy9ep,2020-04-28 17:36:24
"Having to work during this despite being able to make more on unemployment, and exposing myself to the virus daily is making me pretty miserable. Count your blessings.",fow9ln7,fovx2gp,2020-04-28 19:12:45
Now you know what it's like for all the nonsocial people that have had to go out to work every day.,fow8awo,fovx2gp,2020-04-28 19:01:05
sit in the hallway and its 2 walls,fow3awf,fovx2gp,2020-04-28 18:17:04
I'm not at all a social person but it still gets on you being in the same house around the same couple of people all day every day. Couldn't imagine this if I lived alone.,fovz7ua,fovx2gp,2020-04-28 17:42:03
"Me too, it’s made me have zero energy and turned me very pessimistic. I need to see my friends again :(. I’ve had no motivation at ALL to do my college coursework",fovynte,fovx2gp,2020-04-28 17:37:23
No difference in my life except now i make 4x my normal wage on unemployment.,fow5d82,fovovo9,2020-04-28 18:35:14
I think [this](https://youtu.be/uD4izuDMUQA) will help you get through this and gain a new perspective. :),fow1b8x,fovovo9,2020-04-28 17:59:49
"It’s not my mental health but my organization is horrible while working at home. I made my office at the bar in the basement because it’s out of the way and quiet. Then I get yelled at because I made a mess with papers all over. Then for some reason my papers get moved and I can’t find them. Or I set them down when I got home from having to work in the field, then don’t remember where I put them or someone touched them. It’s driving me crazy.",fow1b54,fovovo9,2020-04-28 17:59:48
"Yea I feel bad for you.  I knew people don't enjoy my way of life, but I realized just how much people hate this.  My mental state has actually improved because my life is the same with the exception of not having that 2 - 3 hour round trip commute.Stay strong my friend!",fovz2a8,fovovo9,2020-04-28 17:40:45
"I'm sorry.  I don't consider myself especially vulnerable and it's wearing on me too.  I can imagine it's a much bigger deal for some people.  It's a long time to worry about something, and be so unsettled and unsure, and lack for things you need, whether they are physical or emotional.  The toll from this is so much more than just the death toll and the economic fall out.  It really is a catastrophe in every sense.  I wish you didn't have to live it.  I wish we all didn't.",fovyl28,fovovo9,2020-04-28 17:36:45
"Don't worry. Progress is being made. It's just going much slowed than ""OMG I need to check reddit for signs of progress every ten minutes"".",fovx4yf,fovovo9,2020-04-28 17:24:27
"Nurse here. You recognize our job is not to do that right? Thats your politicians. Their job is to make sure the economic situation doesn’t murder you. Our job is to tell you the truth even if it hurts you financially: “if we don’t do ______, we will have no choice but to shut down again.”",fowt0bk,fovohpg,2020-04-28 22:15:09
"Your comment has been removed because* **Incivility isn’t allowed on this sub.** We want to encourage a respectful discussion. ([More Information](https://www.reddit.com/r/Coronavirus/wiki/rules#wiki_rule_1.3A_be_civil))*I am a bot, and this action was performed automatically. Please [contact the moderators of this subreddit](/message/compose/?to=/r/Coronavirus) if you have any questions or concerns.*",fovowvx,fovowu0,2020-04-28 16:16:38
Only in uncivilized countries.,fox4z25,fowal10,2020-04-29 00:23:14
"It isn't just Wall Street thats hurting these takes are dumb it is thousands of small businesses, franchise owners, normla people who work for public companies. Arguing that its just the stock market that is in being hurt is wrong.",fowq7oh,fovpof3,2020-04-28 21:47:32
"True indeed-personally speaking though, I can see why people are quite upset with medical professionals in general. It’s really easy to support a lockdown that doesn’t crush your entire life when your place of work shuts down. You’re quite right though-it’s not their fault, it just all sucks real bad",fovq9v7,fovpof3,2020-04-28 16:27:46
