Comments,Comment_Id,Comment_ParentId,Timestamp
"This sub sucks. I'm sick of the filler articles. I'm sure threads are still getting locked at the single sign of discussion.  I know no notable news has occured, but c'mon. 3k upvotes on something he's been said already?",fovufej,g9opaq,2020-04-28 17:01:44
All that comes out of this hobbits mouth is fear mongering.,fovuf91,g9opaq,2020-04-28 17:01:42
asking for legitimate and solid good news toward progression is pretty much like expecting a miracle at this point..,fovu4gt,g9opaq,2020-04-28 16:59:18
"I postponed my doctors' appointments until July, but that is as far as I can go. I can't wait until next Spring. I'm at high risk with Covid-19, so I'm just *hoping* it's not as bad in the summer and everyone is wrong about how bad it will be.",fovu2ke,g9opaq,2020-04-28 16:58:51
RemindMe! 8 months,fovtvki,g9opaq,2020-04-28 16:57:16
RemindMe! 4 months,fovt6sy,g9opaq,2020-04-28 16:51:36
I mean how much more is this guy gonna fear monger?This thing has a less than 1 in 1000 chance of being fatal. Let’s move on already,fovt3ha,g9opaq,2020-04-28 16:50:50
I'm really tired of this fauci guy.,fovt024,g9opaq,2020-04-28 16:50:04
I’m tired of hearing from this guy... why is he the only expert we have? Lol,fovscv7,g9opaq,2020-04-28 16:44:48
Why fall and not summer?,fovs3a4,g9opaq,2020-04-28 16:42:38
No shit. Rain is actually wet as well.,fovs2kg,g9opaq,2020-04-28 16:42:29
"This same doctor said 200-300 thousand people would die of Coronavirus in the US, EVEN IF we did all the social distancing measures. Why are we listening to his predictions?  Edit: Fauci said 100k-200k dead AFTER we started distancing [https://www.npr.org/sections/coronavirus-live-updates/2020/03/29/823517467/fauci-estimates-that-100-000-to-200-000-americans-could-die-from-the-coronavirus](https://www.npr.org/sections/coronavirus-live-updates/2020/03/29/823517467/fauci-estimates-that-100-000-to-200-000-americans-could-die-from-the-coronavirus)",fovrvhg,g9opaq,2020-04-28 16:40:51
RemindMe! 5 months,fovru7a,g9opaq,2020-04-28 16:40:33
I guess those of us spared this go round will be getting it in the fall? Have we determined whether people who have had it are immune or not? Chicken pox situation or a seasonal flu one?,fovrqr0,g9opaq,2020-04-28 16:39:46
"Don’t expect TRUMPS administration to give you the truth on this. We will no doubt have more cases and deaths this fall. I just can’t believe how TRUMP and his base supporters are completely acting like this thing is on a downhill slope ! If the States open prematurely, PEOPLE WILL DIE folks !!!",fovq8mz,g9opaq,2020-04-28 16:27:29
"Dude! You're already fucked! I just had my boss from the midwest ask me to come back to work after I already moved back to Quebec!! After I already moved back into my parents house, they asked me to come back. Fuck this shit. You're better off fending for yourself and selling legal weed. Fuck it, that's what time doing up here in Canada.",fovq83l,g9opaq,2020-04-28 16:27:21
"This was said to an economic group, feel like that’s important context.",fovpv4k,g9opaq,2020-04-28 16:24:24
No Trump said it's just flu and hoax sheeple.,fovphfn,g9opaq,2020-04-28 16:21:18
maybe maybe maybe maybe maybe. Why the fuck do non of these assholes know what the fuck is going on yet? Let's destroy our economy and way of life for fucking maybes from assholes. I'm sick of it.,fovouy0,g9opaq,2020-04-28 16:16:11
I hope something good comes soon. My mental health has been going down hill since quarantine kicked in.,fovoit4,g9opaq,2020-04-28 16:13:25
Is it just me or does the first sentence not make sense?,fovobbh,g9opaq,2020-04-28 16:11:46
"Oh And when the sun shine, your face gets warm. Why is this subreddit so flooded with inane USA centric politically tinged articles?",fovnxnm,g9opaq,2020-04-28 16:08:40
[removed],fovnpz8,g9opaq,2020-04-28 16:06:55
Well no shit.  Thank you Captain Obvious.,fovnmw5,g9opaq,2020-04-28 16:06:12
"Is he talking about injected bleach, ingested fish tank cleaner, or anal sunshine?I mean at least one of those has to work,  that's just basic science.",fovnmtx,g9opaq,2020-04-28 16:06:11
"Respectfully speaking though, Dr. Fauci, and many other doctors, aren’t affected by the financial aspect of the shutdown as much as some people are.",fovn3dz,g9opaq,2020-04-28 16:01:47
[removed],fovmwdm,g9opaq,2020-04-28 16:00:13
The virus will still be there in one thousand years and +,fovmrqi,g9opaq,2020-04-28 15:59:10
It took me a long time to realize the headline meant the season and not the collapse of.,fovmhhz,g9opaq,2020-04-28 15:56:51
"Are you going to count asymptomatic people? Honest question, when people calculate mortality from flu do they count people who don't go to the doctor and don't get tested or just people that seek medical attention?I think if you use the same standard and count people who die at home this is much much worse.",fovm6fh,g9opaq,2020-04-28 15:54:25
Captain Obvious,fovlzr4,g9opaq,2020-04-28 15:52:54
But also could not be if they DO!,fovl58m,g9opaq,2020-04-28 15:46:07
"Considering we did everything wrong up to this point, of course it will only get worse.  The US is the epicenter and will continue to be so.",fovkx80,g9opaq,2020-04-28 15:44:18
"Honestly, everyone who can work remotely should work remotely. At least until1. We get more testing - which is doubtful considering our country doesn't seem to have a plan to galvanize industry to provide more raw materials and manufacture the tests, unlike other countries one which has developed a 1 minute test.2. We get more PPE - again, doubtful considering the USA regime's plan is for FEMA to seize PPE meant for the States, unless they have politicians, reporters and the hospital at the airport when the PPE lands3. We know whether humans can become immune to COVID-19 after catching it - still waiting on this?4. We know more about the long term side effects of surviving COVID-19 - besides some having permanently compromised lungs, doctors and scientists aren't sure. They report heart problems, kidney issues, strokes, infertility in men, etc.",fovhpie,g9opaq,2020-04-28 15:18:23
"Careful being honest, Fauci. Trump hates honesty.",fovhhap,g9opaq,2020-04-28 15:16:32
Dooooooooooooooooooooooooooooooooooooooooooooooooooooooooooooooooooooooooooooooooooooooooom,fovhgro,g9opaq,2020-04-28 15:16:25
RemindMe! 6 months,fovgkqk,g9opaq,2020-04-28 15:09:17
"I guess I'm fortunate that my employer took this opportunity to do some office remodeling.  I don't have to go back to the office until the end of June. :)I am hoping that by June, the places that ""re-opened"" early, will be seeing a spike in cases so bad that it can't be covered up or lied about, and saner heads will prevail.",fovge5r,g9opaq,2020-04-28 15:07:50
The fall is going to be a nightmare and the nitwits who want to reopen the economy totally are going to kill people.,fovg5qg,g9opaq,2020-04-28 15:05:57
"None of the treatments currently in the pipeline look anything like miracle curesIt is irresponsible to assume a vaccine, if it is _ever_ successfully developed, is available before next year at minimum.If Fauci seriously believes this, he should be honest with the country regarding how bad this is going to be, because if he seriously believes this, then it's going to get _**much, much worse**_",fovftac,g9opaq,2020-04-28 15:03:10
People need to stop being selfish and stay home,fovfksn,g9opaq,2020-04-28 15:01:15
You mean like hydroxychloroquine which you sold as a possible treatment even without adequate testing? These are the worst scientist. I know everyone loves this guy but I am not one of them.,fovezq0,g9opaq,2020-04-28 14:56:41
[removed],foveh81,g9opaq,2020-04-28 14:52:40
"stay home til we get some proper medicine for this, seems to be the smartest way",fovcmlw,g9opaq,2020-04-28 14:38:00
"A lot of people said that, what’s your point?",foxldoz,fox58ap,2020-04-29 04:08:00
You need proof? They’ve explained time and time again why it will be bad. You can’t have proof of something that hasn’t occurred yet.,foxlgjc,fox2eq4,2020-04-29 04:09:13
Probably because it is all bad news,fox1y28,fowz0s2,2020-04-28 23:49:11
PlayStation 5 is coming out tho ayyy,fox6er2,fowttgo,2020-04-29 00:40:17
"Not just Georgia, a bunch of other states including Colorado, Georgia just got the most publicity",fowsuox,fowm1g7,2020-04-28 22:13:33
"1% ifr is not a given, where are you getting this and why do you seem so sure? .1-.5% ifr from some of the numbers I am seeing.  How do you figure 1%?",fowrfv0,fowj9m1,2020-04-28 21:59:26
"It's a debate we need to have. What is a life worth? Is it worth 100,000 people putting their lives on hold. One million? Is it worth a global recession that will trigger famine across the entire continent of Africa? Is it worth the 30% increase in domestic abuse cases here in the USA? We need to look at the entire picture.",fowlfxl,fowj9m1,2020-04-28 21:01:39
"You don't like hearing the truth, huh?",fowsni5,fowj2nf,2020-04-28 22:11:29
So you're saying you **don't** trust the guy who's been the director of NIAID since 1984?,fowji1z,fowj2nf,2020-04-28 20:43:17
"Read the article. He predicts Trump will face an outbreak ""just as all his predecessors have"". Zika, swine flu, etc. He isn't Nostradamus.",fowiiq4,fowg164,2020-04-28 20:34:07
"Your comment has been removed because* **Purely political posts and comments will be removed.** Political discussions can easily come to dominate online discussions. Therefore we remove political posts and comments and lock comments on borderline posts. ([More Information](https://www.reddit.com/r/Coronavirus/wiki/rules#wiki_rule_4.3A_avoid_politics))*I am a bot, and this action was performed automatically. Please [contact the moderators of this subreddit](/message/compose/?to=/r/Coronavirus) if you have any questions or concerns.*",fowfo9b,fowfo54,2020-04-28 20:07:39
"Your comment has been removed because* **Purely political posts and comments will be removed.** Political discussions can easily come to dominate online discussions. Therefore we remove political posts and comments and lock comments on borderline posts. ([More Information](https://www.reddit.com/r/Coronavirus/wiki/rules#wiki_rule_4.3A_avoid_politics))*I am a bot, and this action was performed automatically. Please [contact the moderators of this subreddit](/message/compose/?to=/r/Coronavirus) if you have any questions or concerns.*",fowfjfe,fowfci2,2020-04-28 20:06:25
"We won't be shutting down again, I guarantee it",fox9wyi,fowepz2,2020-04-29 01:23:49
"Your [comment](https://www.reddit.com/r/Coronavirus/comments/g9opaq/dr_anthony_fauci_warns_us_could_be_in_for_a_bad/fowdt90/) was automatically removed because it referred to a coronavirus-related subreddit which has been quarantined by the reddit admins, who have stated that it may contain misinformation or hoax content.*I am a bot, and this action was performed automatically. Please [contact the moderators of this subreddit](/message/compose/?to=/r/Coronavirus) if you have any questions or concerns.*",fowdtaq,fowdt90,2020-04-28 19:50:40
"Your [comment](https://www.reddit.com/r/Coronavirus/comments/g9opaq/dr_anthony_fauci_warns_us_could_be_in_for_a_bad/fowdkev/) was automatically removed because it referred to a coronavirus-related subreddit which has been quarantined by the reddit admins, who have stated that it may contain misinformation or hoax content.*I am a bot, and this action was performed automatically. Please [contact the moderators of this subreddit](/message/compose/?to=/r/Coronavirus) if you have any questions or concerns.*",fowdkg9,fowdkev,2020-04-28 19:48:29
Lmao,foxca50,fowch84,2020-04-29 01:55:19
"Do yourself a favor and stay off of this sub. As bad as this situation has been, this place makes it seem 10x worse",fowe15i,fowch84,2020-04-28 19:52:39
"Your post or comment has been removed because* **You should contribute only high-quality information.** We require that users submit reliable, fact-based information to the subreddit and provide an English translation for an article in the comments if necessary.  There are many places online to discuss conspiracies and speculate. We ask you not to do so here. ([More Information](https://www.reddit.com/r/Coronavirus/wiki/rules#wiki_rule_5.3A_keep_information_quality_high))*If you believe we made a mistake, please [message the moderators](/message/compose?to=/r/Coronavirus).*",fowc0u9,fowbmc7,2020-04-28 19:34:28
which stocks?,fowmuk2,fow8y3l,2020-04-28 21:15:12
"Your comment has been removed because* **Incivility isn’t allowed on this sub.** We want to encourage a respectful discussion. ([More Information](https://www.reddit.com/r/Coronavirus/wiki/rules#wiki_rule_1.3A_be_civil))*I am a bot, and this action was performed automatically. Please [contact the moderators of this subreddit](/message/compose/?to=/r/Coronavirus) if you have any questions or concerns.*",fow6tuj,fow6tt6,2020-04-28 18:48:10
What state??,fowspih,fow56cc,2020-04-28 22:12:04
"Your comment has been removed because* **Purely political posts and comments will be removed.** Political discussions can easily come to dominate online discussions. Therefore we remove political posts and comments and lock comments on borderline posts. ([More Information](https://www.reddit.com/r/Coronavirus/wiki/rules#wiki_rule_4.3A_avoid_politics))*I am a bot, and this action was performed automatically. Please [contact the moderators of this subreddit](/message/compose/?to=/r/Coronavirus) if you have any questions or concerns.*",fow539t,fow537i,2020-04-28 18:32:47
"They have been saying a couple more weeks for too long. However I knew right away this was no month long adventure, once someone explained to me what  novel"" meant,  disease wise",fow8ibh,fow2jgg,2020-04-28 19:02:56
They’re hearing.  They just don’t care.,fox4w67,fow1uwr,2020-04-29 00:22:18
"Your comment has been removed because* **Purely political posts and comments will be removed.** Political discussions can easily come to dominate online discussions. Therefore we remove political posts and comments and lock comments on borderline posts. ([More Information](https://www.reddit.com/r/Coronavirus/wiki/rules#wiki_rule_4.3A_avoid_politics))*I am a bot, and this action was performed automatically. Please [contact the moderators of this subreddit](/message/compose/?to=/r/Coronavirus) if you have any questions or concerns.*",fow0vsp,fow0vk0,2020-04-28 17:56:10
"Oh boy. If you thought this would have been over in “weeks” you’re at least 2 months behind. This is going to last into most of 2021. It’s not going to “be over” until a vaccine is not only tested and successful but widely available which is next summer at the earliest.Expect social distancing, mask usage, sanitizer and supply shortages to last for a while even if states go “fuck it” and open back up. Your life will not return to anything resembling how it used to be in the foreseeable future.",fowcot0,fow0my6,2020-04-28 19:40:28
"Honestly, I’d be surprised if this is over before next summer.",fow9v8e,fow0my6,2020-04-28 19:15:08
"Actually, you're completely wrong.",fowg4mv,fow0mgc,2020-04-28 20:11:51
Your first mistake is believing any statistics coming out of China.,fow2poi,fow04nu,2020-04-28 18:11:57
"Because government, including local government, is often stupid.",fow2v1v,fovzmbu,2020-04-28 18:13:13
'Gyosh why isn't this guy lying to my face and pulling random nonsense out his ass like Dear Leader?',fowb36p,fovz8kz,2020-04-28 19:26:03
Gonna be hard to get away from others on a packed subway in NYC,fox1mlm,fovysqe,2020-04-28 23:45:37
"> This suggests that the overall clinical consequences of Covid-19 may ultimately be more akin to those of a severe seasonal influenza (which has a case fatality rate of approximately 0.1%) or a pandemic influenza (similar to those in 1957 and 1968) rather than a disease similar to SARS or MERS, which have had case fatality rates of 9 to 10% and 36%, respectively.This, based on ~400 cases reported by China early on.  Turns out science-based recommendation sometimes changes based on availible evidence and accuracy thereof.",fow5kev,fovyejs,2020-04-28 18:37:00
36% of intubated patients typically die.  Current estimates for COVID-19 patients is that 80-90% of intubated patients have died (NY and China studies) . [https://www.physiciansweekly.com/mortality-rate-of-covid-19-patients-on-ventilators/](https://www.physiciansweekly.com/mortality-rate-of-covid-19-patients-on-ventilators/)   It's not a safe assumption that the people placed on vents are ever coming off alive.,fowwyul,fovwzvv,2020-04-28 22:55:51
"Do you mind elaborating on this? Is it an emotional, mental (subconscious?), or physical kind of trauma?",fowrsta,fovwzvv,2020-04-28 22:02:57
RN here. You talking about delirium-related after-effects??,fowr8n4,fovwzvv,2020-04-28 21:57:27
We also barely know the extent of the side-effects in asymptomatic people as well.,fowad63,fovwzvv,2020-04-28 19:19:35
"My fear is that the next logical step for the heads-in-the-sand will be to find creative ways to misreport the cases and deaths numbers, allowing them to push a narrative that doesn't align with reality.",fowuxxl,fovwz3g,2020-04-28 22:34:55
"Man you’re out of touch, do you know how many millions of americans have lost their jobs? How many tens of thousands of businesses that are never going to reopen again? Yes staying closed is important but its not the 1% that are suffering its the average american who can’t afford not to work",fowrn02,fovwz3g,2020-04-28 22:01:24
"Hey, our beaches are semi-open in Daytona. For exercise OR if you hold a disabled parking pass, you may sit by your car parked on the beach, but anyone that came with you must be exercising and not allowed to sit.",fow5iw3,fovwz3g,2020-04-28 18:36:38
Fall is also regular flu season and we still don't have treatment for Covid. You only get a ventilator to keep oxygen in your system. Combine flu w/ covid and ICUs will be hit just as hard again,fow4p63,fovwz3g,2020-04-28 18:29:21
"People on this sub don't get that staying at home does not STOP the virus, only prolongs it.  They need to know that it doesn't matter how long we stay home.  Unless we can stay home for YEARS until a vaccine or treatment is found, the virus will be back with a vengeance whenever we go out.  Those people need to understand this, so they don't become stay at home bullies.  We need to carve a viable path through the virus and bullying certainly doesn't help that process.",fowltvi,fovwsng,2020-04-28 21:05:20
This subreddit is filled with doomsday believers. Social distancing and stay at home orders are significantly helping the spread. If we open up too early there is risk of a spike but this headline is total sensationalism.,fowh5ec,fovwsng,2020-04-28 20:21:21
"4 months is nothing... Hard to know what things will be like in terms of the pandemic, but Fall is what lots of people would normally be planning for right now.",fowcor4,fovwsng,2020-04-28 19:40:28
Some people in this subreddit seem to get off to bad news,fow0zwj,fovwsng,2020-04-28 17:57:10
"They can.  But they can also be reinfected later, even to the point of dying from the second infection.",fow5vm2,fovvpca,2020-04-28 18:39:44
Use reading comprehension and stop interpreting things as we definitely won’t be fucked lol.,fow60ay,fovvk6i,2020-04-28 18:40:55
"You should be sure to call them to see what they recommend. Many hospitals at least have non-covid wings, and some areas have relatively empty hospitals.",fowdckt,fovu2ke,2020-04-28 19:46:30
"Interesting point, why can we not here from the thousands of other experts?  How many epidemiologist and infectious disease people are there?  What about other doctors?",fows6pn,fovscv7,2020-04-28 22:06:46
"The virus doesn’t thrive in the heat, and these sort of seasonal viruses are associated with the fall.",fovz2fa,fovs3a4,2020-04-28 17:40:47
"No he didn’t. The early models explicitly excluded social distancing. His department updated models with social distancing at various intervals, showing a worst case closer to 120k.",fovz9w1,fovrvhg,2020-04-28 17:42:32
Uh that's still happening lmao,fovtjql,fovrvhg,2020-04-28 16:54:32
Because internet thinks he is the sexiest man alive.  Wrong on scientifically important stuff,fovsk20,fovrvhg,2020-04-28 16:46:26
You don’t become immune to chicken pox it lies dormant in your nervous system and maybe comes back as shingles. It’s an amazing virus technically speaking.,fox191u,fovrqr0,2020-04-28 23:41:16
"Or herpes, with no vaccine and reactivations! Woo hoo!",fox05qm,fovrqr0,2020-04-28 23:29:15
WHO just came out with a statement a day or two ago saying they still haven’t seen anything definitive to say you can’t be reinfected.,fowqu8x,fovrqr0,2020-04-28 21:53:32
"Personally, I'm hoping to get it before the fall.  I'm older, but the statistics are still with most of us.  I don't want it during flu season this fall, especially if my case requires hospitalization.",fowjnaw,fovrqr0,2020-04-28 20:44:39
It's still not determined if you gain immunity from infection or not.,fowi9bw,fovrqr0,2020-04-28 20:31:41
"You definitely will.  This level of stupidity,  surprised you manage to make it so far. Remember to eat today...",fovtpga,fovq8mz,2020-04-28 16:55:52
"Exactly,  let's reopen economy.",fovu3p5,fovphfn,2020-04-28 16:59:07
oh my god. if everyone thought like you'd we'd all be dead. go read a paper on COVID that's peer reviewed,fowvt2q,fovouy0,2020-04-28 22:43:47
Haha jokes on you. My mental health can’t get any worse when I already have depression,foxddy3,fovoit4,2020-04-29 02:10:33
I hear you. I think most people are in the same place. I've been drinking way more alcohol than usual (way too much) since March and feel genuinely unhappy. When I go grocery shopping everybody has this look of depression or fear in their eyes. It's starting to weigh down on me quite a bit.,fox2540,fovoit4,2020-04-28 23:51:20
I am getting to the point where anything seems better than this. I seriously wonder at what point will the mental toll surpass the physical one,fox21f8,fovoit4,2020-04-28 23:50:12
You’ll be fine. People in 3rd world countries deal with having to figure out how to eat.,fox1tix,fovoit4,2020-04-28 23:47:47
"In case you don’t know, lots of therapists are doing telehealth for people struggling during the pandemic.",fowxfe9,fovoit4,2020-04-28 23:00:36
"Same. I haven’t wet the bed in probably 33 years. Twice in the last month I’ve woken up to a soaked bed and my tongue swollen, bruised and a mouth full of blood. I apparently had nightmares and chewed my tongue all to hell which meant my poor bladder was just like “weeeeeeee!” Because of the pain. I’ve found more grey hairs in places I’ve never gotten them before. The face masks kick my anxiety into high gear. It’s crazy too, because sometimes it’s like a week or more before I even step outside my door during normal times. I’m a hermit, but I miss going to eat, going to the movies, randomly going to Walmart at 3 am to wander around, going to the mall to get bath bombs and look at American girl dolls. I hate this. Tbh, I don’t think I’ll survive a year of this.",fowv9fu,fovoit4,2020-04-28 22:38:11
Yep. Doesn’t help that I had to put my cat down last week and found out today my grandpa has congestive heart failure. 2020’s been swell...,fowujxa,fovoit4,2020-04-28 22:30:58
"Did you ever check out mindfulness meditation? It reduces stress short term and long term, has proven positive effects on the brain chemistry and has proven positive effects on the immune system.It's maybe the perfect time to give it a try.[https://www.mindful.org/mindfulness-how-to-do-it/](https://www.mindful.org/mindfulness-how-to-do-it/)[https://news.harvard.edu/gazette/story/2018/04/harvard-researchers-study-how-mindfulness-may-change-the-brain-in-depressed-patients/](https://news.harvard.edu/gazette/story/2018/04/harvard-researchers-study-how-mindfulness-may-change-the-brain-in-depressed-patients/)[https://www.ncbi.nlm.nih.gov/pmc/articles/PMC4940234/](https://www.ncbi.nlm.nih.gov/pmc/articles/PMC4940234/)",fowllhm,fovoit4,2020-04-28 21:03:05
"My advice - as hard as this is - Stop reading the news. All of it. I think we all know this is a S#$t show at this point, that's not going to change for quite a while at this rate. Go read a book, go outside, go running, go play a game with kids (if you have them), or in my case, next month, I'm doing a challenge on strava... gunning for about 780 miles on my bike, I haven't done that in about 7 years.",fowhjbo,fovoit4,2020-04-28 20:25:00
Same.&#x200B;I can't imagine what people in third world and developing countries are going through,fowa66c,fovoit4,2020-04-28 19:17:51
"Good: 16.5x as many people have been infected by the virus and almost certainly have immunity.Great: Number of new cases are on the decline and so are deaths.Even Better: The IFR is between 0.1 and 0.8% that means at worst 8 for everyday 1,000 people would die even if herd immunity failed.If herd immunity succeeded that number would be even less.",fow7ewc,fovoit4,2020-04-28 18:53:17
My biggest piece of advice for improving your mental health is to stop looking at this subreddit. It pretty much only circulates the bad news.,fow5zgm,fovoit4,2020-04-28 18:40:42
"Mine has been fine as long as I stay away from the news and social media (including reddit). I’m fine being alone with my cat, but seeing news reports of our bungled response and people not taking it seriously stresses me out.",fow5je1,fovoit4,2020-04-28 18:36:45
"Well... a "" little bit "" of promising news is the University of Oxford in England have started human trials of a vaccine...Equally ""scientists at the university administered a vaccine to six monkeys, all of whom have reportedly been COVID-19-free for 28 days, after being exposed to “heavy quantities” of the virus""",fow4ex8,fovoit4,2020-04-28 18:26:54
